{"acquisitions":[{"acquisitionId":"raw-acquisition-v1-40145a38bfb9ee898425c972","byteLength":720524,"etag":null,"httpStatus":200,"lastModified":null,"mediaType":"application/json; charset=UTF-8","pagination":{"nextPagePresent":true,"total":1142,"totalPages":23},"rawArtifact":"data/raw/sources/make-test-release-signals/2026-10-06T11-51-31Z/001.json","rawSha256":"40145a38bfb9ee898425c9724482b42dade6736babba5e8bdf356df2e823dc01","retrievedAt":"2026-10-06T11:51:31Z","schema":"wordpress.raw-acquisition.v1","sourceUrl":"https://make.wordpress.org/test/wp-json/wp/v2/posts?per_page=50&orderby=modified&order=desc&_fields=id,link,slug,date_gmt,modified_gmt,title,content,tags","version":1}],"adapter":"wp_rest_posts","canonicalHash":"8154310cc45fa3e8d52e1cfb13413c926b491f394db8b53b16d2eb108d140210","receiptId":"retrieval-receipt-v1-8154310cc45fa3e8d52e1cfb","result":"success","retrievedAt":"2026-10-06T11:51:31Z","schema":"wordpress.retrieval-receipt.v1","scope":"50 most recently modified published Make Test posts","sourceFamily":"MAKE_TEST_RELEASE_SIGNALS","version":1}
