{"acquisitions":[{"acquisitionId":"raw-acquisition-v1-9247337059a4b47fb897724d","byteLength":501831,"etag":"W/\"b25da3949321effc9633b277f6eed33dfaf54a45e9337e5003980f9ae1d5f45a\"","httpStatus":200,"lastModified":null,"mediaType":"application/json; charset=utf-8","pagination":{"nextPagePresent":true,"total":null,"totalPages":null},"rawArtifact":"data/raw/sources/core-developer-docs/2026-10-06T11-45-26Z/001.json","rawSha256":"9247337059a4b47fb897724d09a16d9b39c74c6b49fcfcd4053d8a89a13ae064","retrievedAt":"2026-10-06T11:45:26Z","schema":"wordpress.raw-acquisition.v1","sourceUrl":"https://api.github.com/repos/WordPress/Documentation-Issue-Tracker/issues?state=open&sort=updated&direction=desc&per_page=100","version":1}],"adapter":"github_issues","canonicalHash":"769e49c33c4ff4c879788a81d1352994d38e82a7dcfce0524dff81061f227eb2","receiptId":"retrieval-receipt-v1-769e49c33c4ff4c879788a81","result":"success","retrievedAt":"2026-10-06T11:45:26Z","schema":"wordpress.retrieval-receipt.v1","scope":"100 most recently updated open documentation issues","sourceFamily":"CORE_DEVELOPER_DOCS","version":1}
