{"acquisitions":[{"acquisitionId":"raw-acquisition-v1-d10520b64e431adff32e0b27","byteLength":13978,"etag":null,"httpStatus":200,"lastModified":null,"mediaType":"application/json; charset=utf-8","pagination":{"nextPagePresent":false,"total":null,"totalPages":null},"rawArtifact":"data/raw/sources/wordpress-releases/2026-10-06T11-51-55Z/001.json","rawSha256":"d10520b64e431adff32e0b27b34ee74e631f68e7743d15ec77c60b2c702a1387","retrievedAt":"2026-10-06T11:51:55Z","schema":"wordpress.raw-acquisition.v1","sourceUrl":"https://api.wordpress.org/core/version-check/1.7/?channel=beta","version":1},{"acquisitionId":"raw-acquisition-v1-6ee8086b05e16bc4d93f7128","byteLength":1436,"etag":null,"httpStatus":200,"lastModified":null,"mediaType":"application/json; charset=utf-8","pagination":{"nextPagePresent":false,"total":null,"totalPages":null},"rawArtifact":"data/raw/sources/wordpress-releases/2026-10-06T11-51-55Z/002.json","rawSha256":"6ee8086b05e16bc4d93f71289d411cfc2c235eb4f41e099e77640293f0b2d29f","retrievedAt":"2026-10-06T11:51:55Z","schema":"wordpress.raw-acquisition.v1","sourceUrl":"https://api.wordpress.org/core/version-check/1.7/?channel=development","version":1}],"adapter":"wordpress_releases","canonicalHash":"9422e023fdb385881ec8141d1ec145f31a8c50d5f2cb11eb65d55d56b320c97c","receiptId":"retrieval-receipt-v1-9422e023fdb385881ec8141d","result":"success","retrievedAt":"2026-10-06T11:51:55Z","schema":"wordpress.retrieval-receipt.v1","scope":"current beta and development channel offers","sourceFamily":"WORDPRESS_RELEASES","version":1}
