{"acquisitions":[{"acquisitionId":"raw-acquisition-v1-608938d69542f430699b1558","byteLength":348844,"etag":null,"httpStatus":200,"lastModified":null,"mediaType":"application/json; charset=UTF-8","pagination":{"nextPagePresent":true,"total":915,"totalPages":19},"rawArtifact":"data/raw/sources/accessibility-requests/2026-10-06T11-51-51Z/001.json","rawSha256":"608938d69542f430699b1558321ed83ee2eb70284574c484dee5aa4bc1c9f760","retrievedAt":"2026-10-06T11:51:51Z","schema":"wordpress.raw-acquisition.v1","sourceUrl":"https://make.wordpress.org/accessibility/wp-json/wp/v2/posts?per_page=50&orderby=modified&order=desc&_fields=id,link,slug,date_gmt,modified_gmt,title,content,tags","version":1}],"adapter":"wp_rest_posts","canonicalHash":"c7b0137952ba7e3701e55686eec1ee719adc25c4e1f10e332eca47c07ee92bb8","receiptId":"retrieval-receipt-v1-c7b0137952ba7e3701e55686","result":"success","retrievedAt":"2026-10-06T11:51:51Z","schema":"wordpress.retrieval-receipt.v1","scope":"50 most recently modified published Make Accessibility posts","sourceFamily":"ACCESSIBILITY_REQUESTS","version":1}
