{"acquisitions":[{"acquisitionId":"raw-acquisition-v1-df88594f9a72b6e441bbcb8c","byteLength":241608,"etag":null,"httpStatus":200,"lastModified":null,"mediaType":"application/json; charset=UTF-8","pagination":{"nextPagePresent":true,"total":1225,"totalPages":25},"rawArtifact":"data/raw/sources/make-themes-requests/2026-10-06T11-45-31Z/001.json","rawSha256":"df88594f9a72b6e441bbcb8c03d324689348aec610ca496c8b5f396ec5bb06be","retrievedAt":"2026-10-06T11:45:31Z","schema":"wordpress.raw-acquisition.v1","sourceUrl":"https://make.wordpress.org/themes/wp-json/wp/v2/posts?per_page=50&orderby=modified&order=desc&_fields=id,link,slug,date_gmt,modified_gmt,title,content,tags","version":1}],"adapter":"wp_rest_posts","canonicalHash":"1c0462406521fd94e1bd66adb859bea26c505ca2cb9eda491f6e4651ef70b9c2","receiptId":"retrieval-receipt-v1-1c0462406521fd94e1bd66ad","result":"success","retrievedAt":"2026-10-06T11:45:31Z","schema":"wordpress.retrieval-receipt.v1","scope":"50 most recently modified published Make Themes posts","sourceFamily":"MAKE_THEMES_REQUESTS","version":1}
