{"acquisitions":[{"acquisitionId":"raw-acquisition-v1-c58c4ba9580886b09240af30","byteLength":165328,"etag":"W/\"44626eb0ad78e52e43a37a49572e8d0efc4f7a2fed79c5e673deac303d1c29ee\"","httpStatus":200,"lastModified":null,"mediaType":"application/json; charset=utf-8","pagination":{"nextPagePresent":false,"total":null,"totalPages":null},"rawArtifact":"data/raw/sources/theme-check-github/2026-10-06T11-43-15Z/001.json","rawSha256":"c58c4ba9580886b09240af304cda432b7bd73a81199dd38b0270c91ec3382c6a","retrievedAt":"2026-10-06T11:43:15Z","schema":"wordpress.raw-acquisition.v1","sourceUrl":"https://api.github.com/repos/WordPress/theme-check/issues?state=open&sort=updated&direction=desc&per_page=100","version":1},{"acquisitionId":"raw-acquisition-v1-0fb69f85c426fd88a6586bdd","byteLength":184459,"etag":"W/\"396c88306e170036eb82122076038558efe3f49bee777b9b06e7063adcea0ef9\"","httpStatus":200,"lastModified":null,"mediaType":"application/json; charset=utf-8","pagination":{"nextPagePresent":false,"total":null,"totalPages":null},"rawArtifact":"data/raw/sources/theme-check-github/2026-10-06T11-43-15Z/002.json","rawSha256":"0fb69f85c426fd88a6586bdd58eb426b5b1795834036ec0bbc7288dc80b40f72","retrievedAt":"2026-10-06T11:43:15Z","schema":"wordpress.raw-acquisition.v1","sourceUrl":"https://api.github.com/repos/WordPress/theme-check/pulls?state=open&sort=updated&direction=desc&per_page=100","version":1}],"adapter":"github_repository","canonicalHash":"8fd9371787c46bd23d7e8d44982fda81b4be16bbbda56cacdf87008a185b37a3","receiptId":"retrieval-receipt-v1-8fd9371787c46bd23d7e8d44","result":"success","retrievedAt":"2026-10-06T11:43:15Z","schema":"wordpress.retrieval-receipt.v1","scope":"100 most recently updated open Theme Check issues and 100 open pull requests","sourceFamily":"THEME_CHECK_GITHUB","version":1}
